id,title,slug,preview_image,preview_description,content,content_type,video_url,is_published,created_at,published_date
1,Как собрать тихий уикенд в Новом Конаково,kak-sobrat-tihij-uikend-v-novom-konakovo,articles/1.png,Как собрать тихий уикенд в Новом Конаково,"Тихий уикенд в «Новом Конаково» начинается с простого принципа: меньше планов, больше воздуха. В пятницу лучше приехать до заката, чтобы успеть пройтись по берегу и собрать для себя ритм ближайших двух дней.

Утро субботы можно начать с короткой прогулки по лесной тропе. Здесь важно не расстояние, а внимание к деталям: свет между деревьями, звук воды, запах хвои. Такой старт снижает внутренний шум и помогает быстрее переключиться из городского режима.

Днем стоит оставить окно для теплых практик: баня, чай, спокойный разговор в кругу. Это не «активность ради активности», а формат, в котором тело и голова синхронизируются. К вечеру обычно появляется приятная усталость без перегруза.

В воскресенье лучше не пытаться «успеть все». Один маршрут, один длинный завтрак и время без телефона дают больше результата, чем плотный список точек. Именно так уикенд становится восстановлением, а не еще одним проектом.",article,https://www.youtube.com/watch?v=c9DIoSNoQNs,t,2026-02-17 08:58:35.745374+00,2026-02-17
2,Видео-экскурсия по Новому Конаково,video-ekskursiya-po-novomu-konakovo,articles/6.jpeg,Видео-экскурсия по Новому Конаково,"Этот материал — полноценная статья с видео-экскурсией, где собраны ключевые точки «Нового Конаково». Мы показываем маршрут так, как он ощущается в реальном темпе: без резких переключений и перегруженного монтажа.

Перед просмотром лучше открыть карту и отметить места, которые хотите пройти в первую очередь. Это сделает поездку более структурной и поможет не потерять время на хаотичные перемещения.

В тексте к видео мы также собрали практические рекомендации: где лучше делать остановки, в какое время меньше людей и какие точки подходят для спокойного отдыха.

Сначала посмотрите ролик целиком, затем вернитесь к заметкам и соберите свой маршрут на день. Такой подход дает лучший результат, чем попытка повторить все точки сразу.",video,https://www.youtube.com/watch?v=c9DIoSNoQNs,t,2026-02-17 08:59:46.865229+00,2026-02-17
3,5 природных точек для перезагрузки,5-prirodnyh-tochek-dlya-perezagruzki,articles/2.jpeg,5 природных точек для перезагрузки,"В округе «Нового Конаково» есть несколько точек, которые особенно хорошо работают для перезагрузки. Первая — участок берега с открытым горизонтом: здесь легче выровнять дыхание и сбросить напряжение после дороги.

Вторая точка — сосновая тропа, где можно пройтись в спокойном темпе 30-40 минут. Третья — небольшой холм у воды: туда стоит прийти на закате, когда пространство становится тише и визуально мягче.

Четвертая точка — поляна для короткой практики или разминки. Пятая — деревянный настил рядом с водой, где удобно остановиться с чаем и просто посидеть без задач. Главное правило: не пытаться закрыть все пять мест за один день.

Выбирайте две точки на сессию, чтобы маршрут оставался легким. Такой формат дает устойчивый эффект и не превращается в гонку за впечатлениями.",article,https://www.youtube.com/watch?v=c9DIoSNoQNs,t,2026-02-17 09:00:34.868723+00,2026-02-17
4,Утренний беговой клуб: как это выглядит,utrennij-begovoj-klub-kak-eto-vyglyadit,articles/100.webp,Утренний беговой клуб: как это выглядит,"Утренний беговой клуб в Конаково построен вокруг доступного темпа и безопасного входа для новичков. В статье мы разобрали структуру одной тренировки и добавили короткое видео, чтобы было проще оценить формат заранее.

Сессия начинается с разминки, затем идет основной блок на комфортной скорости и финальное восстановление. Если вы только начинаете, можно пройти часть маршрута пешком — это нормальная практика внутри группы.

Видео помогает понять динамику и атмосферу: как команда держит ритм, где проходят остановки и как тренер дает обратную связь. Такой предварительный просмотр снижает тревогу перед первым визитом.

После тренировки участники обычно остаются на короткий разговор и планирование следующих встреч. Это укрепляет регулярность и повышает мотивацию.",article,https://www.youtube.com/watch?v=c9DIoSNoQNs,t,2026-02-17 09:01:18.887227+00,2026-02-17
5,Гид по сезонным активностям: февраль,gid-po-sezonnym-aktivnostyam-fevral,articles/5.jpeg,Гид по сезонным активностям: февраль-март,"Переходный сезон в Конаково хорошо подходит для мягких активностей. Погода еще меняется, но уже можно собирать комбинированный ритм: прогулка, тренировка, вечерняя встреча в теплом пространстве.

Утренние окна лучше отдавать движению: легкий бег, скандинавская ходьба или короткая разминка на свежем воздухе. Днем — спокойные маршруты с остановками у воды и небольшими точками отдыха.

К вечеру хорошо работают камерные события: чтение, обсуждение маршрутов, чайные встречи. Такой баланс между движением и тишиной дает устойчивое ощущение наполненности, а не усталости.

Главное — оставлять запас по энергии и не планировать больше двух активностей на день. Тогда сезон ощущается как поддержка, а не как нагрузка.",article,https://www.youtube.com/watch?v=c9DIoSNoQNs,t,2026-02-17 09:02:12.921234+00,2026-02-17
