id,avatar,name,event_name,rating,text,date,created_at
1,reviews/portrait-white-man-isolated.jpg,Мария К.,Утренние практики,5,«Утренние практики помогли перезагрузиться и настроиться на день. После занятий появляется ясность и спокойствие — очень рекомендую.»,2026-02-17,2026-02-17 08:39:06.54818+00
2,reviews/blonde-woman-blue-shirt-posing.jpg,Ольга Н.,Игра «Лила» ·,4,"«Игра «Лила» оказалась глубже, чем я ожидала. Без давления, с уважением и поддержкой — очень ценный опыт.»",2026-02-17,2026-02-17 08:39:33.651513+00
3,reviews/handsome-cheerful-man-with-happy-smile.jpg,Игорь С.,Мастер-класс,4,"«Мастер-класс прошёл легко и интересно. Понравился подход: спокойно, дружелюбно и при этом очень содержательно.»",2026-02-17,2026-02-17 08:40:03.908109+00
4,reviews/close-up-young-cute-redhead-girl-smiling-winking.jpg,Мария С.,Экскурсия,5,"«Экскурсия в «Братство лосей» — очень тёплый и спокойный опыт. Всё организовано бережно, без спешки, с вниманием к деталям.»",2026-02-17,2026-02-17 08:40:35.789809+00
5,reviews/young-beautiful-girl-suspiciously-thinking_1.jpg,Екатерина Д.,Утренние практики,5,«Утренние практики помогли перезагрузиться и настроиться на день. После занятий появляется ясность и спокойствие — очень рекомендую.»,2026-02-17,2026-02-17 08:41:38.29593+00
